{"asset":"SOLUSDT","deriv":{"cvd_proxy":{"futures":"n/a","spot":"n/a"},"funding":"n/a","lsr":"n/a","oi":"n/a"},"schema":"market_snapshot.v1","tf_state":{"15m":{"ema20":"n/a","ema200":"n/a","ema50":"n/a","price":"n/a","rsi":"n/a","vwap":"n/a"},"1h":{"ema20":"n/a","ema200":"n/a","ema50":"n/a","price":"n/a","rsi":"n/a","vwap":"n/a"},"1m":{"ema20":"n/a","ema200":"n/a","ema50":"n/a","price":"n/a","rsi":"n/a","vwap":"n/a"},"4h":{"ema20":"n/a","ema200":"n/a","ema50":"n/a","price":"n/a","rsi":"n/a","vwap":"n/a"},"5m":{"ema20":"n/a","ema200":"n/a","ema50":"n/a","price":"n/a","rsi":"n/a","vwap":"n/a"}},"ts_utc":"2026-02-08T20:29:06Z"}
